{
  "tabId": "500123",
  "tabLabel": "example_value",
  "documentId": "500123",
  "pageNumber": "example_value",
  "recipientId": "500123",
  "xPosition": "example_value",
  "yPosition": "example_value",
  "anchorString": "example_value",
  "selected": "example_value",
  "required": "example_value",
  "locked": "example_value"
}